content,score,date,option,satis_list
좋아요~ 맥주효모처음써보는데 좋다고 들어서 구매했어요ㅎ 탈모효과는 한달써봐야할듯해요,5,22.03.04.,조합상품: 7. 탈모샴푸1개+여행용샴푸4개,"['세정력_보통이에요', '두피자극_보통이에요', '탈모케어_잘 모르겠어요']"
한달사용기좋아요좋아요좋아요좋아요좋아요좋아요좋아요좋아요좋아요좋아요좋아요좋아요좋아요좋아요좋아요좋아요좋아요좋아요좋아요좋아요좋아요좋아요좋아요좋아요좋아요좋아요좋아요좋아요좋아요좋아요좋아요,5,22.04.19.,조합상품: 5. 탈모샴푸1개+트리트먼트1개,"['두피자극_순해요', '탈모케어_아주 만족해요', '세정력_아주 만족해요']"
한달사용기엄마가 써보시더니 좋다고 하시네요~ 다쓰고 또주문하신다고 합니다~,5,22.03.28.,조합상품: 1. 탈모샴푸500mlX1개,"['두피자극_순해요', '탈모케어_아주 만족해요', '세정력_아주 만족해요']"
재구매한 웅큼씩 빠지던 머리가 이샴푸 사용하면서 덜 빠지는거 같아요. 포장도 터지지 않게 뽀복이에 잘 감싸져와서 좋아요.,5,22.03.02.,조합상품: 1. 탈모샴푸500mlX1개,"['두피자극_순해요', '탈모케어_아주 만족해요', '세정력_아주 만족해요']"
다른샴프에비해 머리기름이 빨리져요,5,22.03.19.,조합상품: 1. 탈모샴푸500mlX1개,"['세정력_다소 아쉬워요', '두피자극_순해요', '탈모케어_잘 모르겠어요']"
씻을때도 엄청 부드럽고 말린후에도 머리결이 부드러워요,5,22.03.16.,조합상품: 1. 탈모샴푸500mlX1개,"['두피자극_순해요', '탈모케어_아주 만족해요', '세정력_아주 만족해요']"
한달사용기잘 사용하고 있습니다,5,22.04.12.,종류: 2. 비어멕 탈모샴푸 500ml,"['두피자극_순해요', '탈모케어_잘 모르겠어요', '세정력_아주 만족해요']"
한달사용기좋아요좋아요좋아요좋아요좋아요좋아요좋아요좋아요좋아요좋아요좋아요좋아요좋아요좋아요좋아요좋아요좋아요좋아요좋아요,5,22.04.19.,조합상품: 3. 탈모샴푸2개,"['두피자극_순해요', '탈모케어_아주 만족해요', '세정력_아주 만족해요']"
한달사용기재구매또 구입해야할 시기가 되돌아 오네요 여러제품을 써봤지만  가성비도 좋고 만족 합니다. 탈모도 많이 좋아졌습니다. 감고나면 상쾌한 느낌이 좋습니다.,5,22.02.21.,종류: 2. 비어멕 탈모샴푸 500ml,"['세정력_보통이에요', '두피자극_순해요', '탈모케어_아주 만족해요']"
향이 배이비파우더네요 ㅋㅋ 맥주가 함유는 되어 있나용!! 존슨주 배이비 로션으로 감는 기분?? 머리결은 나쁘지 않아용,5,22.03.23.,조합상품: 1. 탈모샴푸500mlX1개,"['두피자극_순해요', '탈모케어_잘 모르겠어요', '세정력_아주 만족해요']"
탈모 효과 있는지는 아직 잘모르겠어요 꾸준히 써봐야겠죠?,4,22.03.28.,조합상품: 3. 탈모샴푸2개,"['세정력_보통이에요', '두피자극_보통이에요', '탈모케어_잘 모르겠어요']"
한달사용기괜찮아요 괜찮아요 괜찮아요,4,22.05.04.,조합상품: 1. 탈모샴푸500mlX1개,"['세정력_보통이에요', '두피자극_보통이에요', '탈모케어_잘 모르겠어요']"
정말 좋습니다 추천드려요,5,22.04.04.,조합상품: 3. 탈모샴푸2개,"['두피자극_순해요', '탈모케어_아주 만족해요', '세정력_아주 만족해요']"
머리카락이 다른 샴푸보다 덜빠져서 재구매함,5,22.04.04.,조합상품: 1. 탈모샴푸 500ml X 1개,"['세정력_보통이에요', '두피자극_보통이에요', '탈모케어_잘 모르겠어요']"
두번째 구매 소중한 내 머리카락 위해 ㅋ,5,22.03.03.,조합상품: 1. 탈모샴푸500mlX1개,"['두피자극_순해요', '탈모케어_아주 만족해요', '세정력_아주 만족해요']"
한달사용기재구매효과는 잘 모르겠지만 믿고 써보는중입니다,5,22.04.04.,종류: 2. 비어멕 탈모샴푸 500ml,"['두피자극_순해요', '탈모케어_잘 모르겠어요', '세정력_아주 만족해요']"
재구매이거쓰몀 머리빵꾸난거 다 매꿔짐,5,22.03.15.,조합상품: 1. 탈모샴푸500mlX1개,"['두피자극_순해요', '탈모케어_아주 만족해요', '세정력_아주 만족해요']"
한달사용기재구매벌써 또 다 사용해가요 또 주문하러오겠습니다,5,22.03.11.,종류: 2. 비어멕 탈모샴푸 500ml,"['두피자극_순해요', '탈모케어_잘 모르겠어요', '세정력_아주 만족해요']"
재구매아직은 잘 모르겠습니다,4,22.04.06.,조합상품: 5. 탈모샴푸1개+트리트먼트1개,"['세정력_보통이에요', '두피자극_보통이에요', '탈모케어_잘 모르겠어요']"
효모샴푸좋은것알고사용합니다,5,22.04.01.,조합상품: 1. 탈모샴푸 500ml X 1개,"['두피자극_순해요', '탈모케어_아주 만족해요', '세정력_아주 만족해요']"
"재구매재구매했어요~ 한달밖에 써보질 않아서 큰 효과는 아직 잘 모르겠으나. 믿고 써보고 싶어서 구매했고, 탈모샴푸는 보통 머리감으면 뻣뻣한데 이건 거품이 잘나서 좋은것 같아요~",5,22.03.12.,조합상품: 1. 탈모샴푸500mlX1개,"['세정력_보통이에요', '두피자극_보통이에요', '탈모케어_잘 모르겠어요']"
한달사용기사용 전보다 머리 빠짐이 덜 한것 같아요  믿고 사용중입니다,5,22.03.10.,종류: 3. 비어멕  트리트먼트 500ml,"['두피자극_순해요', '탈모케어_아주 만족해요', '세정력_아주 만족해요']"
한달사용기사용 전보다 머리 빠짐이 덜 한것 같아요  믿고 사용중입니다,5,22.03.10.,종류: 2. 비어멕 탈모샴푸 500ml,"['두피자극_순해요', '탈모케어_아주 만족해요', '세정력_아주 만족해요']"
받아서 한번 써 봤는데  머리 감을깨 머리카락 일단 많이 안 빠지는것 같아요. 거품은 많이 나는 편인것 같고  향도 있어요.  더 써 봐야 알것 같아요 .,5,22.02.24.,조합상품: 3. 탈모샴푸2개,"['두피자극_순해요', '탈모케어_잘 모르겠어요', '세정력_아주 만족해요']"
"한달사용기머리감으면  손에 거품과 빠진 머리카락이 수북했는데 이 제품쓰고 확실하게 줄었어요.   넘 만족중이고, 앞으로도 이 샴푸만 쓸거에요",5,22.03.16.,종류: 3. 비어멕 탈모샴푸 500ml+ 100ml,"['두피자극_순해요', '탈모케어_아주 만족해요', '세정력_아주 만족해요']"
한달사용기재구매계속 쓰던거라 쭈욱 이용하고 있음,5,22.04.01.,조합상품: 2. 탈모 트리트먼트 500mlX1개,"['세정력_보통이에요', '두피자극_보통이에요', '탈모케어_잘 모르겠어요']"
언제부턴가 머리가 마니 빠져서 신경쓰이던 차에 언니에게 추천받아 쓰게 됐어요. 별 기대없었는데 오~효과가 있어요. 확실히 덜 빠져요. 꾸준히 써보려구요,5,22.02.16.,조합상품: 3. 탈모샴푸2개,"['두피자극_순해요', '탈모케어_아주 만족해요', '세정력_아주 만족해요']"
한달사용기머리가 덜빠지는거 같긴해요 열심히 사용하는 중입니다,4,22.03.02.,종류: 2. 비어멕 탈모샴푸 500ml,"['두피자극_순해요', '탈모케어_아주 만족해요', '세정력_아주 만족해요']"
한달사용기두피가 개운한 기분이 들고 자극적이지 않은 것 같아요.,4,22.03.05.,종류: 2. 비어멕 탈모샴푸 500ml,"['세정력_보통이에요', '두피자극_보통이에요', '탈모케어_잘 모르겠어요']"
거품이 잘 나고 머리카락도 덜 빠지는듯해요  샴푸만쓰면 뻣뻣한감이 있어서 트리트먼트 사용해야합니다~샴푸후에 머리카락이 풍성해지는 감이 있어요 만족해요~~ 꾸준히 사용해보고 또 후기남길께요~~,5,22.02.09.,조합상품: 1. 탈모샴푸500mlX1개,"['두피자극_순해요', '탈모케어_아주 만족해요', '세정력_아주 만족해요']"
좋다고추천받아서구매했어요^^,5,22.03.30.,조합상품: 3. 탈모샴푸 500ml X 2개,"['두피자극_순해요', '탈모케어_아주 만족해요', '세정력_아주 만족해요']"
한달사용기머리가 더 빠지지는 않는것 같아요,5,22.03.31.,조합상품: 5. 탈모샴푸1개+트리트먼트1개,"['세정력_보통이에요', '두피자극_보통이에요', '탈모케어_아주 만족해요']"
한달사용기재구매맥주효모라서 냄새이상할줄알았는데 향기좋아요그리고 쓰고나면 부드러워요,5,22.02.22.,종류: 2. 비어멕 탈모샴푸 500ml,"['두피자극_순해요', '탈모케어_아주 만족해요', '세정력_아주 만족해요']"
머리결이 가볍고 부드러우며 뭔가 관리 받은거처럼 산뜻하고 좋아요 기름진 아들도 만족하네요,5,22.03.17.,조합상품: 3. 탈모샴푸2개,"['두피자극_순해요', '탈모케어_아주 만족해요', '세정력_아주 만족해요']"
한달사용기전 보단 모발이 두꺼워지고 탈모가 약간 개선된 느낌 입니다,5,22.03.26.,조합상품: 1. 탈모샴푸500mlX1개,"['세정력_보통이에요', '두피자극_순해요', '탈모케어_잘 모르겠어요']"
엄청 순하고 두피 가려움이 없어요! 추천추천,5,22.03.22.,조합상품: 1. 탈모샴푸500mlX1개,"['두피자극_순해요', '탈모케어_아주 만족해요', '세정력_아주 만족해요']"
한달사용기재구매좋아요 좋아요 좋아요,5,22.04.24.,조합상품: 3. 탈모샴푸2개,"['두피자극_순해요', '탈모케어_아주 만족해요', '세정력_아주 만족해요']"
너무너무너무너무좋아요,5,22.04.02.,조합상품: 5. 탈모샴푸1개+트리트먼트1개,"['두피자극_순해요', '탈모케어_아주 만족해요', '세정력_아주 만족해요']"
그냥 그러네요    쿨링감은 없어요,4,22.03.24.,조합상품: 1. 탈모샴푸500mlX1개,"['두피자극_순해요', '탈모케어_아주 만족해요', '세정력_아주 만족해요']"
재구매재구매하고 있는 상품입니다 믿고 사용합니다,5,22.03.25.,조합상품: 3. 탈모샴푸 500ml X 2개,"['두피자극_순해요', '탈모케어_아주 만족해요', '세정력_아주 만족해요']"
한달사용기향도 좋고 잘쓰고 있습니다,5,22.03.04.,종류: 2. 비어멕 탈모샴푸 500ml,"['두피자극_순해요', '탈모케어_잘 모르겠어요', '세정력_아주 만족해요']"
한달사용기아직 잘 모르겠어요  순한편인듯 합니다,4,22.03.20.,종류: 2. 비어멕 탈모샴푸 500ml,"['두피자극_보통이에요', '탈모케어_잘 모르겠어요', '세정력_아주 만족해요']"
늘쓰던거에요..라방이 저렴해서 쟁여놔써요..모발은 굵어지는 느낌이고 무엇보다 볼륨이 살아서 좋아요..냄새도 좋고 샴푸만해도 부드러워 온가족들이 다쓰는중인데 대만족해요,5,22.02.03.,조합상품: 6. 여행용샴푸100ml 4개,"['두피자극_순해요', '탈모케어_아주 만족해요', '세정력_아주 만족해요']"
한달사용기민감한 피부임에도 트러블 없이 잘 사용하고 있습니다.,5,22.02.25.,종류: 2. 비어멕 탈모샴푸 500ml,"['두피자극_순해요', '탈모케어_아주 만족해요', '세정력_아주 만족해요']"
헬스클럽 및 여행용으로 조아요~^^,5,22.03.22.,조합상품: 6. 여행용샴푸100ml 4개,"['두피자극_순해요', '탈모케어_아주 만족해요', '세정력_아주 만족해요']"
배송 잘받았습니다 상품 괜찮은것 같아요,4,22.03.16.,조합상품: 1. 탈모샴푸500mlX1개,"['세정력_보통이에요', '두피자극_보통이에요', '탈모케어_잘 모르겠어요']"
빠른배송 만족합니다,5,22.03.02.,조합상품: 3. 탈모샴푸2개,"['두피자극_순해요', '탈모케어_잘 모르겠어요', '세정력_아주 만족해요']"
배송 빠르고 머리가 조금 덜  빠지는거같아요,4,22.03.18.,조합상품: 1. 탈모샴푸500mlX1개,"['세정력_보통이에요', '두피자극_순해요', '탈모케어_잘 모르겠어요']"
한달사용기아직 잘 모르겠네요,3,22.03.26.,조합상품: 3. 탈모샴푸2개,"['세정력_보통이에요', '두피자극_보통이에요', '탈모케어_잘 모르겠어요']"
엄마가 탈모고민하셔서 구매했는데 좋으시데요~ 꾸준히써보려합니당~,5,22.03.12.,조합상품: 1. 탈모샴푸500mlX1개,"['두피자극_순해요', '탈모케어_아주 만족해요', '세정력_아주 만족해요']"
한달사용기손상이 많은 모발이라 샴푸를 하고 나면 엉킴이 심했는데 이 제품을 쓰고 나서 많이 좋아졌습니다,5,22.02.23.,종류: 4. 비어멕 트리트먼트 500ml,"['두피자극_순해요', '탈모케어_잘 모르겠어요', '세정력_아주 만족해요']"
요즘머리가ㅜ망ㅎ이빠뎌서 써보게요 근데 이건 뭔가요?,4,22.02.22.,조합상품: 1. 탈모샴푸500mlX1개,"['세정력_보통이에요', '두피자극_보통이에요', '탈모케어_잘 모르겠어요']"
일반 샴푸처럼 가볍고 풍성하게 거품이 나진 않지만 보통과 달리 감은 후 가려움 같은 것들이 전혀 없어서 오늘 처음 써봤는데 아주 만족합니다. 냄새도 파우더리한 향이라 좋아요. 지루성 두피염이 있는 편인데 감을 때 청량감이 느껴지고 순해서 감은 후에도 두피가 편하고 가벼운 기분이 들어요 잘맞는 것 같네요 좋습니다.,5,22.01.21.,종류: 2. 비어멕 탈모샴푸 500ml,"['두피자극_순해요', '탈모케어_잘 모르겠어요', '세정력_아주 만족해요']"
좋다고 해서 한통쓰고 다시 구매했어요. 효과는 잘 모르겠어요^^;;,5,22.03.14.,조합상품: 3. 탈모샴푸2개,"['세정력_보통이에요', '두피자극_따끔거려요', '탈모케어_잘 모르겠어요']"
너무 잘쓰고 있어요~,3,22.03.02.,조합상품: 2. 탈모 트리트먼트 500mlX1개,"['세정력_보통이에요', '두피자극_보통이에요', '탈모케어_잘 모르겠어요']"
거품도 풍성하게 잘나고 좋은거 같은데 효과는 아직 잘 모르겠어요~,5,22.02.21.,조합상품: 3. 탈모샴푸2개,"['두피자극_보통이에요', '탈모케어_잘 모르겠어요', '세정력_아주 만족해요']"
재구매 했어요 좋아요,5,22.03.03.,조합상품: 1. 탈모샴푸500mlX1개,"['두피자극_순해요', '탈모케어_아주 만족해요', '세정력_아주 만족해요']"
좋다고해서 구매했습니다. 이런건 한달리뷰를 봐야하겠죠? 한 달뒤 뵙겠습니다.,5,22.02.17.,조합상품: 1. 탈모샴푸500mlX1개,"['세정력_보통이에요', '두피자극_보통이에요', '탈모케어_잘 모르겠어요']"
나이가 먹다보니 두피가 빠지는것에 신경을 많이 썼는데 비어멕을 써보니 정말 좋은것 같아요,5,22.03.11.,조합상품: 3. 탈모샴푸2개,"['두피자극_순해요', '탈모케어_아주 만족해요', '세정력_아주 만족해요']"
한달사용기아직 잘 모르겠네....,3,22.03.26.,조합상품: 2. 탈모 트리트먼트 500mlX1개,"['세정력_보통이에요', '두피자극_보통이에요', '탈모케어_잘 모르겠어요']"
탈모케어가 되었는지는 아직 모르겠어요! 한달 써보고 후기 작성 다시 할게요.,4,22.03.08.,조합상품: 3. 탈모샴푸2개,"['두피자극_순해요', '탈모케어_잘 모르겠어요', '세정력_아주 만족해요']"
샴푸외구매해서사용중입니다 너무만족스러워요 두피열도덜하고 기름이확실히덜집니다^^,5,22.03.03.,조합상품: 4. 탈모 트리트먼트2개,"['두피자극_순해요', '탈모케어_아주 만족해요', '세정력_아주 만족해요']"
재구매탈모케어에 탁월한 효과는 아직 체감은 안되지만 혹시나 하는 기대감으로 이용 합니다.,5,22.02.19.,조합상품: 2. 탈모 트리트먼트 500mlX1개,"['세정력_보통이에요', '두피자극_순해요', '탈모케어_잘 모르겠어요']"
동생집에서 써보고 좋아서 주문했어요. 염색을 자주 해서 머리결도 상하고 탈모가 걱정되서 꾸준히 써보려합니다. 써보고 한달리뷰 쓸게요 배송도 빠르고 포장상태 굿,5,22.01.22.,종류: 4. 비어멕 트리트먼트 500ml,"['두피자극_순해요', '탈모케어_아주 만족해요', '세정력_아주 만족해요']"
"재구매수년간 사용해오던 제품입니다  머리에 볼륨을 살려줘요 향도 좋고,부족함이 없습니다  긴머리이신 분들은 비어맥 트린트먼트 함께 써주시면 더욱 좋아요~",5,22.02.22.,조합상품: 1. 탈모샴푸500mlX1개,"['두피자극_순해요', '탈모케어_아주 만족해요', '세정력_아주 만족해요']"
재구매조아요조아요조아요조아요,5,22.03.13.,조합상품: 1. 탈모샴푸500mlX1개,"['세정력_보통이에요', '두피자극_보통이에요', '탈모케어_잘 모르겠어요']"
주문도 잘못한것도 모르고있었는데 전화 주셔서 확인하시고  제가 원하는 구성대로 보내주시고 넘 감동이었어요 요즘 머리가 너무빠지길래 주문했는데 오늘받자마자 사진찍고  머리를감아봤는데  아직 효과는 모르지만 세정효과도 좋고 뻣뻣하지도않아서 좋았어요 한달동안사용해보고 다시 리뷰 올리겠습니다,5,22.01.21.,종류: 4. 비어멕 트리트먼트 500ml,"['두피자극_순해요', '탈모케어_아주 만족해요', '세정력_아주 만족해요']"
이것만 씁니다 다른거 쓰면 린스 꼭 써야 되는데 이건 샴푸만 써도 괜찮아요,5,22.03.10.,조합상품: 3. 탈모샴푸2개,"['두피자극_순해요', '탈모케어_아주 만족해요', '세정력_아주 만족해요']"
빠른배송 감사합니다~,5,22.03.16.,조합상품: 3. 탈모샴푸2개,"['두피자극_순해요', '탈모케어_아주 만족해요', '세정력_아주 만족해요']"
한달사용기머릿결도 샴푸후 부드러운느낌이고 두피에 뭐나는게 사라졌어요,5,22.02.20.,종류: 2. 비어멕 탈모샴푸 500ml,"['두피자극_순해요', '탈모케어_아주 만족해요', '세정력_아주 만족해요']"
조금만 써도 거품이 많이 나요 향도 파우더리해서 마음에 드네요,5,22.02.10.,조합상품: 1. 탈모샴푸500mlX1개,"['두피자극_순해요', '탈모케어_잘 모르겠어요', '세정력_아주 만족해요']"
아직 1-2회 사용만 해보았지만 효과가 있길 기대해보겠습니다. 빠른 배송과 꼼꼼한 포장 감사합니다,5,22.02.13.,조합상품: 3. 탈모샴푸2개,"['두피자극_순해요', '탈모케어_아주 만족해요', '세정력_아주 만족해요']"
아직 몇 번 써보지 않아서 모르겠지만 효과가 있었으면 좋겠어요 파우더리한 향은 좋아요,4,22.02.12.,조합상품: 1. 탈모샴푸500mlX1개,"['두피자극_순해요', '탈모케어_잘 모르겠어요', '세정력_아주 만족해요']"
쓴지얼만안되어 더써보고 계속구매예정입니다,5,22.03.14.,조합상품: 1. 탈모샴푸500mlX1개,"['두피자극_순해요', '탈모케어_아주 만족해요', '세정력_아주 만족해요']"
라이브를 통해 좋은설명과 좋은가격으로 구매했어요^^ 샴푸할때 확실히 머리가 안빠집니다!! 제가 생각했을때 단점은.. 없는거같습니다^^,5,22.02.05.,조합상품: 7. 탈모샴푸1개+여행용샴푸4개,"['두피자극_순해요', '탈모케어_아주 만족해요', '세정력_아주 만족해요']"
사용 후 머리가 힘이 생긴 느낌입니다. 잘 사용하겠습니다.,5,22.03.14.,조합상품: 1. 탈모샴푸500mlX1개,"['두피자극_순해요', '탈모케어_아주 만족해요', '세정력_아주 만족해요']"
항상 잘 사용하고 있습니다..~ㅎㅎ,5,22.03.16.,조합상품: 4. 탈모 트리트먼트2개,"['두피자극_순해요', '탈모케어_아주 만족해요', '세정력_아주 만족해요']"
진짜좋네요 당분간 이샴푸 당첨!,5,22.03.13.,조합상품: 1. 탈모샴푸500mlX1개,"['두피자극_순해요', '탈모케어_아주 만족해요', '세정력_아주 만족해요']"
한달사용기전 가끔써서 잘 모르겠지만 좀 화~해요 남편은 좋다네요,4,22.02.14.,종류: 2. 비어멕 탈모샴푸 500ml,"['세정력_보통이에요', '두피자극_보통이에요', '탈모케어_잘 모르겠어요']"
재구매수년째 사용중입니다 너무좋아요.,5,22.02.18.,조합상품: 3. 탈모샴푸2개,"['두피자극_순해요', '탈모케어_아주 만족해요', '세정력_아주 만족해요']"
처음사보는데 만족합니다  꾸준히 구매할게요,5,22.03.08.,조합상품: 5. 탈모샴푸1개+트리트먼트1개,"['두피자극_순해요', '탈모케어_아주 만족해요', '세정력_아주 만족해요']"
빠른배송감사합니다!!,5,22.03.11.,,"['두피자극_순해요', '탈모케어_아주 만족해요', '세정력_아주 만족해요']"
한달사용기재구매솜털같은 머리가 납니다.,5,22.03.14.,종류: 2. 비어멕 탈모샴푸 500ml,"['두피자극_순해요', '탈모케어_아주 만족해요', '세정력_아주 만족해요']"
거품도자나고 상케합니다 맘족합니다,5,22.03.11.,조합상품: 1. 탈모샴푸500mlX1개,"['두피자극_순해요', '탈모케어_잘 모르겠어요', '세정력_아주 만족해요']"
향도 좋고 거품도 많이 나고 좋습니다 두피가 깨끗해지는 느낌~^^ 탈모케어가 되는지는 아직 모르지만 꾸준히 써보려구요,5,22.02.19.,조합상품: 5. 탈모샴푸1개+트리트먼트1개,"['두피자극_순해요', '탈모케어_잘 모르겠어요', '세정력_아주 만족해요']"
써보시면 반할거에요..냄새도 좋고 모발도 굵어지고 볼륨도 살고..지금은 정착중,5,22.02.03.,조합상품: 4. 탈모 트리트먼트2개,"['두피자극_순해요', '탈모케어_아주 만족해요', '세정력_아주 만족해요']"
좋아요좋아요좋아요좋아요좋아요좋아요좋아요좋아요좋아요좋아요좋아요좋아요좋아요좋아요좋아요좋아요좋아요좋아요좋아요좋아요좋아요좋아요좋아요좋아요좋아요좋아요좋아요좋아요좋아요좋아요좋아요좋아요좋아요좋아요좋아요좋아요좋아요좋아요좋아요좋아요좋아요좋아요좋아요좋아요좋아요좋아요좋아요좋아요좋아요좋아요좋아요좋아요좋아요좋아요좋아요좋아요좋아요좋아요좋아요좋아요좋아요좋아요좋아요좋아요좋아요좋아요좋아요좋아요좋아요좋아요좋아요좋아요좋아요좋아요좋아요좋아요좋아요좋아요좋아요좋아요좋아요좋아요좋아요좋아요좋아요좋아요좋아요좋아요좋아요좋아요좋아요좋아요좋아요좋아요좋아요좋아요좋아요좋아요좋아요좋아요좋아요좋아요좋아요좋아요좋아요좋아요좋아요좋아요좋아요좋아요좋아요좋아요좋아요좋아요좋아요좋아요좋아요좋아요좋아요,5,22.03.14.,조합상품: 5. 탈모샴푸1개+트리트먼트1개,"['두피자극_순해요', '탈모케어_아주 만족해요', '세정력_아주 만족해요']"
좋아요좋아요좋아요좋아요좋아요좋아요좋아요좋아요좋아요좋아요좋아요좋아요좋아요좋아요좋아요좋아요좋아요좋아요좋아요좋아요좋아요좋아요좋아요좋아요좋아요좋아요좋아요좋아요좋아요좋아요좋아요좋아요좋아요좋아요좋아요좋아요좋아요좋아요좋아요좋아요좋아요좋아요좋아요좋아요좋아요좋아요좋아요좋아요좋아요좋아요좋아요좋아요좋아요좋아요좋아요좋아요좋아요좋아요좋아요좋아요좋아요좋아요좋아요좋아요좋아요좋아요좋아요좋아요좋아요좋아요좋아요좋아요좋아요좋아요좋아요좋아요좋아요좋아요좋아요좋아요좋아요좋아요좋아요좋아요좋아요좋아요좋아요좋아요좋아요좋아요좋아요좋아요좋아요좋아요좋아요좋아요좋아요좋아요좋아요좋아요좋아요좋아요좋아요좋아요좋아요좋아요좋아요좋아요좋아요좋아요,5,22.03.14.,조합상품: 3. 탈모샴푸2개,"['두피자극_순해요', '탈모케어_아주 만족해요', '세정력_아주 만족해요']"
한달사용기향도 좋고 부드러워요,4,22.02.17.,종류: 2. 비어멕 탈모샴푸 500ml,"['세정력_보통이에요', '두피자극_보통이에요', '탈모케어_잘 모르겠어요']"
재구매너무좋아요 계속쓰려구요~♡♡짱입니다,5,22.02.08.,조합상품: 4. 탈모 트리트먼트2개,"['두피자극_순해요', '탈모케어_아주 만족해요', '세정력_아주 만족해요']"
빠른배송좋은제품감사합니다,5,22.03.04.,조합상품: 3. 탈모샴푸2개,"['세정력_보통이에요', '두피자극_순해요', '탈모케어_잘 모르겠어요']"
한달사용기재구매너무좋아요 굿입니다^^계속사용하려구요,5,22.02.08.,종류: 2. 비어멕 탈모샴푸 500ml,"['두피자극_순해요', '탈모케어_아주 만족해요', '세정력_아주 만족해요']"
한달사용기재구매너무좋아요 굿입니다^^계속사용하려구요,5,22.02.08.,종류: 3. 비어멕  트리트먼트 500ml,"['두피자극_순해요', '탈모케어_아주 만족해요', '세정력_아주 만족해요']"
곗속써보려구요 향도 좋구 자극도 없네요|,4,22.02.14.,조합상품: 3. 탈모샴푸2개,"['두피자극_순해요', '탈모케어_잘 모르겠어요', '세정력_아주 만족해요']"
