content,score,date,option,satis_list
한달사용기출산 후 탈모로 추천받아 구매했는데 별로 효과 없어요.,2,21.01.31.,종류: 1. 비어멕 독일맥주효모 탈모샴푸,"['세정력_보통이에요', '두피자극_보통이에요', '탈모케어_별로예요']"
탈모가 줄어들고 조금의 양만사용해도 거품도 많고순해서 좋아묘,5,21.02.02.,종류: 1. 비어멕 독일맥주효모 탈모샴푸,"['두피자극_순해요', '탈모케어_아주 만족해요', '세정력_아주 만족해요']"
한달사용기재구매우연히 알게 된 후로 꾸준히 계속 쓰고 있어요. 대놓고 대용량은 아닌데 많지 않은 양으로도 거품이 풍부하게 나서 생각보다 오래 씁니다. 사은품도 없고 가격도 싸지 않지만 돈 아깝단 생각은 안 드네요 ^^ 감사히 잘 쓰고 있습니다. 건강하시고 번창하세요!!,5,20.12.17.,종류: 2. 비어멕 독일맥주효모 트리트먼트,"['두피자극_순해요', '탈모케어_아주 만족해요', '세정력_아주 만족해요']"
한달사용기재구매우연히 알게 된 후로 꾸준히 계속 쓰고 있어요. 대놓고 대용량은 아닌데 많지 않은 양으로도 거품이 풍부하게 나서 생각보다 오래 씁니다. 사은품도 안 주고 가격도 싸지 않지만 돈 아깝단 생각은 안 들어요 ^^ 감사히 잘 쓰고 있습니다. 건강하시고 번창하세요!!,5,20.12.17.,종류: 1. 비어멕 독일맥주효모 탈모샴푸,"['두피자극_순해요', '탈모케어_아주 만족해요', '세정력_아주 만족해요']"
한달사용기쓰다가 저하고 안맞아서 중단했어요ㅜ,3,21.02.10.,종류: 1. 비어멕 독일맥주효모 탈모샴푸,"['세정력_다소 아쉬워요', '두피자극_따끔거려요', '탈모케어_별로예요']"
진작 사서 쓸껄 그랬어요 좋으네요,5,21.01.17.,종류: 1. 비어멕 독일맥주효모 탈모샴푸,"['두피자극_순해요', '탈모케어_아주 만족해요', '세정력_아주 만족해요']"
한달사용기재구매향도좋고 아이가 괜찮다고해서 꾸준히 쓸려구요^^,4,21.02.05.,종류: 1. 비어멕 독일맥주효모 탈모샴푸,"['세정력_보통이에요', '두피자극_순해요', '탈모케어_잘 모르겠어요']"
마누라야 이거쓰고 대머리 되지말아라ㅜㅜ,5,21.02.09.,종류: 2. 비어멕 독일맥주효모 트리트먼트,"['두피자극_순해요', '탈모케어_아주 만족해요', '세정력_아주 만족해요']"
재구매제가 쓰고 좋아서 선물용으로 구입했어요,5,21.02.04.,종류: 1. 비어멕 독일맥주효모 탈모샴푸,"['두피자극_순해요', '탈모케어_아주 만족해요', '세정력_아주 만족해요']"
완전 좋습니다~!!,5,21.02.15.,종류: 1. 비어멕 독일맥주효모 탈모샴푸,"['두피자극_순해요', '탈모케어_아주 만족해요', '세정력_아주 만족해요']"
향기도 좋고..효모는 잘..,5,21.01.20.,종류: 1. 비어멕 독일맥주효모 탈모샴푸,"['세정력_보통이에요', '두피자극_순해요', '탈모케어_잘 모르겠어요']"
한달사용기재구매제가 너무효과본것같다같다 느낌으로만 그랬는데.. 진심이에요~ 두피테스트를받으러갔는데 효과만랩이에여~~ 두피상태도 모발건강도 개선되는게 보였어요~ 두피센터에서도 뭘따로 권하지않더라구요~~^^,5,20.12.26.,종류: 1. 비어멕 독일맥주효모 탈모샴푸,"['두피자극_순해요', '탈모케어_아주 만족해요', '세정력_아주 만족해요']"
기대하고 있어요. 꾸준히 써봐야죠.,5,21.01.11.,종류: 1. 비어멕 독일맥주효모 탈모샴푸,"['두피자극_순해요', '탈모케어_잘 모르겠어요', '세정력_아주 만족해요']"
원래 머리숱이 많고 허리까지 길고 두피가 건강해서 샴푸 쓰면 즉각적으로 아는데요.  3번쓰고 후기 작성하내요. 보통은 10개 정도 빠지는데 3 달 사이 너무많이 빠져 구입햇어요.  빠진거 보니 반 정도는 줄어든거 같아요.  머리카락이 실짝 힘잇어지고 굵어집니다.,5,21.01.12.,종류: 2. 비어멕 독일맥주효모 트리트먼트,"['세정력_보통이에요', '두피자극_보통이에요', '탈모케어_아주 만족해요']"
"좋다고 해서 구매했어요, 잘 쓸께요",5,21.01.12.,종류: 1. 비어멕 독일맥주효모 탈모샴푸,"['세정력_보통이에요', '두피자극_보통이에요', '탈모케어_잘 모르겠어요']"
받고 몇번 쓰진 않았지만 첫인상이 너무좋아요 향도좋고 두피자극도 없고 감고 나서 느낌도 너무 좋네요 추천받고 산건데 잘 산거같아요!!,5,21.01.11.,종류: 1. 비어멕 독일맥주효모 탈모샴푸,"['두피자극_순해요', '탈모케어_아주 만족해요', '세정력_아주 만족해요']"
시원한 느낌이드네요 효과가있으면 좋겠어요 맥주효모환이랑 같이써요,4,21.01.03.,종류: 1. 비어멕 독일맥주효모 탈모샴푸,"['두피자극_순해요', '탈모케어_잘 모르겠어요', '세정력_아주 만족해요']"
한달 후에 평가하겠습니다. 아직까진 좋네요,5,21.01.09.,종류: 1. 비어멕 독일맥주효모 탈모샴푸,"['두피자극_순해요', '탈모케어_아주 만족해요', '세정력_아주 만족해요']"
"거의 모든 후기에서 향기가 좋다는 평을 읽었는데 그때문에 기대치가너무 높아진걸까..ㅠ 솔직히 향은  쏘쏘 였어요. 뭐랄까...그냥 무난한  향이었어요. 대중스럽달까? 전혀  좋은향,이라고는 생각되지않는. 근데 며칠 써보니 오히려 그게더 나을수도 있겠더라구요. 여자인 저는 헤어에센스라든가향수라든가 뿌리는게많으니...  세정력은 탁월하구요, 탈모예방?효과는 아직 모르겠어요..ㅜ 이전까지 닥터그루트 썼는데,솔직히 와..탈모완화 효과 1도 없어서 이번에 제품 바꾼거거든요.. 한달 써보고 효과보면 다시 후기 올릴게요...",3,20.11.24.,종류: 1. 비어멕 독일맥주효모 탈모샴푸,"['두피자극_보통이에요', '탈모케어_잘 모르겠어요', '세정력_아주 만족해요']"
배송도 빠르고 이번기회이 바꿔보려구요 잘쓸게요,5,21.01.02.,종류: 1. 비어멕 독일맥주효모 탈모샴푸,"['두피자극_순해요', '탈모케어_아주 만족해요', '세정력_아주 만족해요']"
한달사용기샴푸만해도 린스한 것 처럼 부드럽고 향도 좋습니다 . 모든게 다 마음에 들지만 시간이 지나면 지날수록 머리에 기름지는 느낌이네요,5,21.01.20.,종류: 2. 비어멕 독일맥주효모 트리트먼트,"['세정력_보통이에요', '두피자극_순해요', '탈모케어_아주 만족해요']"
아직은 잘 모르겠지만 열심히 써보고 효과가 있음 계속 써볼게요!!,5,21.01.31.,종류: 1. 비어멕 독일맥주효모 탈모샴푸,"['세정력_보통이에요', '두피자극_보통이에요', '탈모케어_잘 모르겠어요']"
"재구매탈모케어 당장은 모르겠지만, 꾸준히 쓰다보면 좋아지겠지 싶어서 지속적으로 사용중. 순하고, 세정력은 확실히 좋아요.",4,21.01.16.,,"['두피자극_순해요', '탈모케어_잘 모르겠어요', '세정력_아주 만족해요']"
아직까진 잘 모르겠어요 써보고 있습니다,4,21.01.27.,종류: 1. 비어멕 독일맥주효모 탈모샴푸,"['세정력_보통이에요', '두피자극_보통이에요', '탈모케어_잘 모르겠어요']"
한달사용기탈모.. 그냥 약을 드세요. 탈모샴푸 라며 나온 것들은 원효대사 해골물 마냥 그냥 본인이 아 덜 빠지네 라며 스스로를 속이이며 사용하는 제품들 같습니다. 효과 없으니 그냥 약을 먹고 샴푸는 두피검사 받아서 약용샴푸를 사용하는게 베스트일 듯.,2,21.01.08.,종류: 1. 비어멕 독일맥주효모 탈모샴푸,"['세정력_보통이에요', '두피자극_보통이에요', '탈모케어_별로예요']"
배송도 빠르고 제품이 순해서 마음에 들어요^^,5,21.01.26.,,"['두피자극_순해요', '탈모케어_잘 모르겠어요', '세정력_아주 만족해요']"
아직 효과는 모르지만 좋은것같아요,5,21.02.01.,종류: 1. 비어멕 독일맥주효모 탈모샴푸,"['세정력_보통이에요', '두피자극_순해요', '탈모케어_잘 모르겠어요']"
탈모 때문에 샀는데 기대됩니다.,3,21.02.02.,종류: 1. 비어멕 독일맥주효모 탈모샴푸,"['세정력_보통이에요', '두피자극_순해요', '탈모케어_잘 모르겠어요']"
배송도 오래 걸렸지만 10일간 사용해봤는데 저랑 안 맞네요. 오히려 더 빠졌어요.,1,20.12.20.,종류: 1. 비어멕 독일맥주효모 탈모샴푸,"['세정력_다소 아쉬워요', '두피자극_보통이에요', '탈모케어_별로예요']"
재구매자주사료. 좋은 제품입니다,5,21.01.08.,종류: 1. 비어멕 독일맥주효모 탈모샴푸,"['두피자극_순해요', '탈모케어_아주 만족해요', '세정력_아주 만족해요']"
처음써봤는데 좋아요,5,21.01.31.,종류: 1. 비어멕 독일맥주효모 탈모샴푸,"['두피자극_순해요', '탈모케어_아주 만족해요', '세정력_아주 만족해요']"
후기가 좋아서 고민하다 주문했어요. 두피가 붉고  간지러움이 유독 심햇져서..  좋아지길 기대하며 사용중입니다. 간지러움이 줄긴했는데 안간지럽진않아요 일단열심히 써보렵니다  좋아지길 바랍니다,4,20.12.16.,종류: 1. 비어멕 독일맥주효모 탈모샴푸,"['세정력_보통이에요', '두피자극_보통이에요', '탈모케어_잘 모르겠어요']"
3통째 쓰는데 세정력도 좋은것 같고 머리가 덜 빠지는거 같아요 지속적으로 쓰려구여,5,21.01.19.,종류: 1. 비어멕 독일맥주효모 탈모샴푸,"['두피자극_순해요', '탈모케어_아주 만족해요', '세정력_아주 만족해요']"
배송도 빠르고 좋아요^^ 감사합니다,5,21.01.17.,종류: 1. 비어멕 독일맥주효모 탈모샴푸,"['두피자극_순해요', '탈모케어_아주 만족해요', '세정력_아주 만족해요']"
재구매쓰고 있는 상품 중에 재일 좋은거 같아요,5,21.01.25.,종류: 1. 비어멕 독일맥주효모 탈모샴푸,"['두피자극_순해요', '탈모케어_아주 만족해요', '세정력_아주 만족해요']"
오늘 받았구요 아직 사용은 못했습니다,4,21.01.23.,종류: 1. 비어멕 독일맥주효모 탈모샴푸,"['세정력_보통이에요', '두피자극_보통이에요', '탈모케어_잘 모르겠어요']"
아직 두번 사용했는데요...확실한 효과부분은  한달정도 사용후 다시 적는게 정확하겠죳? 우선 향은 괜찮은것 같구요~~ 다른 탈모 샴푸 많이 사용했는데 두피가 굉장히 개운함을 느꼈는데  이 샴푸는 그런건 없는것 같아요. 탈모도 탈모지만 지루성에 효과좋다는 글보고 구매했는데 우선 꾸준히 사용해볼생각입니다. 꼭 효과가 있었음하는 바램입니다.,3,20.12.25.,종류: 1. 비어멕 독일맥주효모 탈모샴푸,"['세정력_보통이에요', '두피자극_보통이에요', '탈모케어_잘 모르겠어요']"
따로 린스 안써도 부들부들하고 머리카락이 튼튼해지는 거 같아서 재구매햇어요,5,21.01.21.,종류: 1. 비어멕 독일맥주효모 탈모샴푸,"['두피자극_순해요', '탈모케어_아주 만족해요', '세정력_아주 만족해요']"
느낌탓인지... 머리가 덜빠지는 느낌이에요!! 향도 무난하고 샴푸만해도 머리가 부드러워지는 것 같네여 재구매의사 있습니당,5,21.01.08.,종류: 1. 비어멕 독일맥주효모 탈모샴푸,"['두피자극_순해요', '탈모케어_아주 만족해요', '세정력_아주 만족해요']"
한달사용기한달넘게 사용중이긴 한데 큰 변화를 못느끼고 있어요....ㅜ,3,21.01.05.,종류: 1. 비어멕 독일맥주효모 탈모샴푸,"['세정력_보통이에요', '두피자극_보통이에요', '탈모케어_잘 모르겠어요']"
한달사용기두발에 좋아요  다시 구매 합니다,5,21.01.20.,종류: 1. 비어멕 독일맥주효모 탈모샴푸,"['두피자극_순해요', '탈모케어_아주 만족해요', '세정력_아주 만족해요']"
한달사용기잘 쓰고있어요 다쓰면 또 주문할게요,5,21.01.04.,종류: 2. 비어멕 독일맥주효모 트리트먼트,"['세정력_보통이에요', '두피자극_보통이에요', '탈모케어_아주 만족해요']"
엄마가 쓰시는건데 또 주문해달라셔서요. 괜찮은가봅니다,5,21.01.14.,종류: 1. 비어멕 독일맥주효모 탈모샴푸,"['두피자극_보통이에요', '탈모케어_아주 만족해요', '세정력_아주 만족해요']"
지인이 사용해보고 좋다고해서 구매했습니다.  효과있기를 기대하며 꾸준히 사용해보겠습니다.,5,20.12.21.,종류: 1. 비어멕 독일맥주효모 탈모샴푸,"['두피자극_순해요', '탈모케어_잘 모르겠어요', '세정력_아주 만족해요']"
한달사용기정말 최고의 제품 항상 애용하고있습니다 아직도 안써보신분은 꼳 써보시고 제조사분들 초심잃지마시고 이제품 많이 많이 만들어주세요~,5,20.12.17.,종류: 2. 비어멕 독일맥주효모 트리트먼트,"['두피자극_보통이에요', '탈모케어_아주 만족해요', '세정력_아주 만족해요']"
재구매좋아뇨~~~~~~~,5,21.02.21.,종류: 1. 비어멕 독일맥주효모 탈모샴푸,"['두피자극_순해요', '탈모케어_잘 모르겠어요', '세정력_아주 만족해요']"
재구매좋아뇨~~~~~~~,5,21.02.21.,종류: 2. 비어멕 독일맥주효모 트리트먼트,"['두피자극_순해요', '탈모케어_잘 모르겠어요', '세정력_아주 만족해요']"
아기샴푸처럼.순해요 향도 좋고 ^^*,5,21.01.17.,종류: 1. 비어멕 독일맥주효모 탈모샴푸,"['두피자극_순해요', '탈모케어_아주 만족해요', '세정력_아주 만족해요']"
재구매늘 쓰던거라 잘 쓰겠습니다.,5,21.01.22.,종류: 1. 비어멕 독일맥주효모 탈모샴푸,"['세정력_보통이에요', '두피자극_보통이에요', '탈모케어_잘 모르겠어요']"
한달사용기완전 잘쓰고있어요 ㅎㅎ,5,21.01.04.,종류: 1. 비어멕 독일맥주효모 탈모샴푸,"['세정력_보통이에요', '두피자극_보통이에요', '탈모케어_잘 모르겠어요']"
재구매구매자가  많아서  기대감에 기입했슥니다. 효과는 아직 모르겠어요,5,21.01.18.,종류: 1. 비어멕 독일맥주효모 탈모샴푸,"['세정력_보통이에요', '두피자극_순해요', '탈모케어_잘 모르겠어요']"
재구매두통째 사용^^ 아주 만족해요,5,21.01.17.,종류: 1. 비어멕 독일맥주효모 탈모샴푸,"['두피자극_순해요', '탈모케어_아주 만족해요', '세정력_아주 만족해요']"
재구매거품도 풍부하고 향도 은은하고 좋아요,5,21.01.15.,종류: 2. 비어멕 독일맥주효모 트리트먼트,"['두피자극_순해요', '탈모케어_아주 만족해요', '세정력_아주 만족해요']"
잘사용해 보겠습니다. 기대되네요,5,21.01.02.,종류: 1. 비어멕 독일맥주효모 탈모샴푸,"['두피자극_순해요', '탈모케어_아주 만족해요', '세정력_아주 만족해요']"
재구매제가.머리가 빠져서 고민이여서 속는셈치고써보자는 마음으로 처음엔 썼는데 동생이 제머리속을보더니 언니 머리가 좀 채워진거같아? 하는 말을하더라구요~ 오 머리많이빠졌던 가르마쪽응 떠둘러보니 진짜 효과제대로 보는중이에요~~저랑 너무 잘맞는 제품이네요~~ 엄마도 쓰시고 저도 또 한통쓰려고 추가구매합니다! 추천 추천 두번세번 추천드립니다😀,5,20.11.24.,종류: 1. 비어멕 독일맥주효모 탈모샴푸,"['두피자극_순해요', '탈모케어_아주 만족해요', '세정력_아주 만족해요']"
한달사용기잘 사용하고있습니다~~,5,21.01.05.,종류: 1. 비어멕 독일맥주효모 탈모샴푸,"['세정력_보통이에요', '두피자극_보통이에요', '탈모케어_잘 모르겠어요']"
한달사용기머리결이 너무 부드럽고 좋아요.,5,20.12.30.,종류: 1. 비어멕 독일맥주효모 탈모샴푸,"['두피자극_순해요', '탈모케어_아주 만족해요', '세정력_아주 만족해요']"
몃년째사용중입니다 너무좋아요,5,20.12.29.,종류: 1. 비어멕 독일맥주효모 탈모샴푸,"['두피자극_순해요', '탈모케어_아주 만족해요', '세정력_아주 만족해요']"
지인이 사용해보고 좋다고해서 구매했습니다. 효과있기를 기대해봅니다.,5,20.12.21.,종류: 2. 비어멕 독일맥주효모 트리트먼트,"['두피자극_순해요', '탈모케어_잘 모르겠어요', '세정력_아주 만족해요']"
향도좋고 머리감을때 머리카락이 덜빠지는거같아요,5,21.01.14.,종류: 1. 비어멕 독일맥주효모 탈모샴푸,"['두피자극_순해요', '탈모케어_아주 만족해요', '세정력_아주 만족해요']"
한달사용기잘사용하고있어요~^^,5,21.01.05.,종류: 2. 비어멕 독일맥주효모 트리트먼트,"['세정력_보통이에요', '두피자극_보통이에요', '탈모케어_잘 모르겠어요']"
재구매꾸준히 쓰고 있어요,5,21.01.21.,종류: 1. 비어멕 독일맥주효모 탈모샴푸,"['두피자극_순해요', '탈모케어_아주 만족해요', '세정력_아주 만족해요']"
아직 몇번못써보긴했는데 거품기에 짜서 펌핑해서 쓰는데 거품잘만들어지고 퐁신퐁신합니당 향도 나쁘지않구요 감고나서 당장은 뭔가 부들해요ㅎㅎ 덜빠지기를 바랍니다 효과있었음좋겠어요ㅜ,5,20.12.06.,종류: 1. 비어멕 독일맥주효모 탈모샴푸,"['두피자극_순해요', '탈모케어_잘 모르겠어요', '세정력_아주 만족해요']"
두번째 구입합니다.,5,21.01.24.,종류: 1. 비어멕 독일맥주효모 탈모샴푸,"['두피자극_보통이에요', '탈모케어_잘 모르겠어요', '세정력_아주 만족해요']"
두번째 구입합니다.,5,21.01.24.,종류: 2. 비어멕 독일맥주효모 트리트먼트,"['두피자극_보통이에요', '탈모케어_잘 모르겠어요', '세정력_아주 만족해요']"
한달사용기아직 한달이라 모르겠지만 효과있겠죠~~~,5,20.12.28.,종류: 1. 비어멕 독일맥주효모 탈모샴푸,"['두피자극_순해요', '탈모케어_잘 모르겠어요', '세정력_아주 만족해요']"
빠른 배송 감사합니다 어서 써봐야겠어요,5,21.01.13.,종류: 1. 비어멕 독일맥주효모 탈모샴푸,"['세정력_보통이에요', '두피자극_순해요', '탈모케어_잘 모르겠어요']"
아직  써보지 못했어요  트리트먼트  주셔서  감사합니다  잘  쓸께요,5,21.01.08.,종류: 1. 비어멕 독일맥주효모 탈모샴푸,"['두피자극_순해요', '탈모케어_아주 만족해요', '세정력_아주 만족해요']"
빠른배송 깔끔배송 좋아요,5,20.12.26.,종류: 2. 비어멕 독일맥주효모 트리트먼트,"['두피자극_순해요', '탈모케어_아주 만족해요', '세정력_아주 만족해요']"
재구매탈모에 효과가 있으면 좋겠네요.,4,21.01.18.,종류: 1. 비어멕 독일맥주효모 탈모샴푸,"['세정력_보통이에요', '두피자극_보통이에요', '탈모케어_잘 모르겠어요']"
한달사용기반정도 썼는데 또주문하려구요 트리트먼트안써도 부드럽고 머리감고 빠지는양이 줄어든거같아요 좀더써보고 또주문예정입니다,5,20.12.23.,종류: 1. 비어멕 독일맥주효모 탈모샴푸,"['두피자극_순해요', '탈모케어_아주 만족해요', '세정력_아주 만족해요']"
한달사용기부드러워요~~윤기나 보여요~~,5,20.12.27.,종류: 2. 비어멕 독일맥주효모 트리트먼트,"['세정력_보통이에요', '두피자극_보통이에요', '탈모케어_잘 모르겠어요']"
한달사용기꾸준히 사용중 입니다~~,4,20.12.27.,종류: 1. 비어멕 독일맥주효모 탈모샴푸,"['세정력_보통이에요', '두피자극_보통이에요', '탈모케어_잘 모르겠어요']"
한달사용기맥주효모 좋다고해서 구매했어요 일단향은 좋네요,5,21.01.06.,종류: 1. 비어멕 독일맥주효모 탈모샴푸,"['두피자극_순해요', '탈모케어_아주 만족해요', '세정력_아주 만족해요']"
한달사용기맥주효모 좋다고해서 구매했어요 일단향은 좋네요,5,21.01.06.,종류: 2. 비어멕 독일맥주효모 트리트먼트,"['두피자극_순해요', '탈모케어_아주 만족해요', '세정력_아주 만족해요']"
효과가 있는지 써봐야 알거같습니다 기대는 해봅니다,4,21.01.09.,종류: 1. 비어멕 독일맥주효모 탈모샴푸,"['두피자극_순해요', '탈모케어_잘 모르겠어요', '세정력_아주 만족해요']"
머리 숱도많아 보이고 좋아요,5,21.01.13.,종류: 1. 비어멕 독일맥주효모 탈모샴푸,"['두피자극_순해요', '탈모케어_아주 만족해요', '세정력_아주 만족해요']"
재구매향도 만족스럽고 부드릐워서 좋네요ㅎ,5,21.01.12.,종류: 1. 비어멕 독일맥주효모 탈모샴푸,"['두피자극_순해요', '탈모케어_잘 모르겠어요', '세정력_아주 만족해요']"
자세한건 더 써보고 남길게용,5,20.12.26.,종류: 1. 비어멕 독일맥주효모 탈모샴푸,"['두피자극_순해요', '탈모케어_아주 만족해요', '세정력_아주 만족해요']"
우선 냄새도 나쁘지 않고 적은양으로도 거품 잘나고 탈모효과는 계속 써볼께요,4,20.12.16.,종류: 1. 비어멕 독일맥주효모 탈모샴푸,"['두피자극_순해요', '탈모케어_잘 모르겠어요', '세정력_아주 만족해요']"
재구매탈모목적아니어도 샴푸가 찐으로 좋아요! 두피가 개운한데 또 세정이너무 과하거나 건조해서 생기는 비듬같은 것도 안생기고요! 동생이 세상 숱많음+곱슬머리+머리긺으로 머리 잘안감기면 빡쳐하는타입인데 이거 사서 집에뒀더니 하나 더사달라고 하더라고요! 만족또만족입니다,5,20.11.19.,종류: 1. 비어멕 독일맥주효모 탈모샴푸,"['두피자극_순해요', '탈모케어_아주 만족해요', '세정력_아주 만족해요']"
향은 좋아요 지금부터 사용해볼께요,5,21.01.08.,종류: 1. 비어멕 독일맥주효모 탈모샴푸,"['두피자극_보통이에요', '탈모케어_잘 모르겠어요', '세정력_아주 만족해요']"
한달사용기확실한 효과는 모르겠지만 잘 사용 중 입니다,5,20.12.18.,종류: 1. 비어멕 독일맥주효모 탈모샴푸,"['두피자극_순해요', '탈모케어_아주 만족해요', '세정력_아주 만족해요']"
대단히 마음에 듭니다 효과가 기대됩니다,5,20.12.19.,종류: 1. 비어멕 독일맥주효모 탈모샴푸,"['두피자극_순해요', '탈모케어_아주 만족해요', '세정력_아주 만족해요']"
"탈모 케어에 도움이 되는 것 같아서 세 통, 네 통 째 쓰고 있어요!! 빠른 배송도 감사합니다.",5,20.12.02.,종류: 1. 비어멕 독일맥주효모 탈모샴푸,"['세정력_보통이에요', '두피자극_보통이에요', '탈모케어_아주 만족해요']"
잘쓸게요 배송은 빨라요,5,20.12.15.,종류: 2. 비어멕 독일맥주효모 트리트먼트,"['세정력_보통이에요', '두피자극_보통이에요', '탈모케어_잘 모르겠어요']"
한달사용기재구매써보고 좋아서 형부한테 선물하고 재구매했어요 ㅋ,5,21.01.06.,종류: 1. 비어멕 독일맥주효모 탈모샴푸,"['두피자극_순해요', '탈모케어_아주 만족해요', '세정력_아주 만족해요']"
잘쓸게요  더 써봐야 알거같아요 ㅎ,5,20.12.15.,종류: 1. 비어멕 독일맥주효모 탈모샴푸,"['세정력_보통이에요', '두피자극_보통이에요', '탈모케어_아주 만족해요']"
한달사용기거품이 풍부하게 나와서 좋았어요,4,21.01.05.,종류: 1. 비어멕 독일맥주효모 탈모샴푸,"['세정력_보통이에요', '두피자극_보통이에요', '탈모케어_잘 모르겠어요']"
부드럽고 향도 좋고 좋앗습니다,5,21.01.08.,종류: 1. 비어멕 독일맥주효모 탈모샴푸,"['두피자극_순해요', '탈모케어_아주 만족해요', '세정력_아주 만족해요']"
재구매세번째 구입입니다~,5,20.12.24.,종류: 1. 비어멕 독일맥주효모 탈모샴푸,"['두피자극_순해요', '탈모케어_아주 만족해요', '세정력_아주 만족해요']"
머리 감고나니 수분을 머금고 있는 그런 머리결 만족해요,5,21.01.03.,종류: 2. 비어멕 독일맥주효모 트리트먼트,"['두피자극_순해요', '탈모케어_아주 만족해요', '세정력_아주 만족해요']"
한달사용기꾸준히 쓰고있습니다 잔머리도 나는거같구 계속 쓰려구요,3,21.01.03.,종류: 1. 비어멕 독일맥주효모 탈모샴푸,"['세정력_보통이에요', '두피자극_순해요', '탈모케어_잘 모르겠어요']"
잘 받았습니다 감사합니다,5,21.01.05.,종류: 1. 비어멕 독일맥주효모 탈모샴푸,"['두피자극_순해요', '탈모케어_아주 만족해요', '세정력_아주 만족해요']"
한달사용기탈모가 걱정되서 예방차원에서 사용하고 있는데 좋아요.,4,20.12.13.,종류: 1. 비어멕 독일맥주효모 탈모샴푸,"['두피자극_순해요', '탈모케어_아주 만족해요', '세정력_아주 만족해요']"
