content,score,date,option
늘 쓰고있는 샴푸라 떨어질때가되어 다시 구입했어요 스타벅스 머그컵도 예뻐요 화이트로 왔으면 더좋았을텐데 블랙잘쓸께요 번창하세요,5,22.09.22.,
머리가 넘 많이 빠져서 샴푸는 닥터그루트만 사용해요~저렴하게 잘 사서 좋아요!다쓰고 재구매하러 또 올게요~~,5,21.11.10.,
매일사용하는 제품인데 샴푸중에 제일 좋은것같아요 머리도 풍성해보이고 뿌리가 살아있어요 만족합니다,5,22.09.02.,
써보니 머리결도 다른 탈모 샴푸에 비해 좀 부드럽고 좀더 힘 있어보이고 향도 계속 쓰다보니 나쁘진않네요..번창 하세요..,5,21.11.15.,
닥터그루트 샴푸 좋아서 구매검색해서 샀어요 두피에 도움이 되는거 같아요 잘 쓸께요,5,22.03.18.,
머리 기름기도 잘 잡아주고 머리 빠지는것도 많이 줄어 꾸준히 사용합니다 오프라인보다 훨씬 저렴해서 좋아요,5,22.02.22.,
항상 쓰던건데 첨 인터넷 구매해봤어요.마트보다 많이 저렴하네요. 넘 좋아요,5,22.04.16.,
늘 쓰던 상품입니다 저렴하게 구입해서 좋아요다음번에도 주문할께요,5,22.02.25.,선택: 힘없는 모발용 샴푸 400ml
동네 마트 보다 훨씬 싸게 잘 샀어요~유통기한도 넉넉하네요,5,22.03.02.,선택: 힘없는 모발용 샴푸 400ml
늘 마트에서 사던거 저렴하게 득템했습니다!! 번창하세요!!,5,22.02.22.,
처음써보는데 후기가 좋아서 기대됩니다.탈모 예방에 거품나는 샴푸 찾다가 주문했습니다.,5,21.06.05.,
항상 사용하던거에요. 만족합니다. 종이포장재도 좋아요,5,21.11.28.,
늘 쓰던건데 저렴하게 샀네요빠른 배송도 감사드립니다,5,21.06.04.,
스벅컵 하얀색이길 바랐지만 검정색 와서 아쉬워요. 그래도 구매 잘한 것 같아요. 고마워요.,5,23.02.22.,
꾸준히  쓰고있는데 거품잘나고 양모효과 최고에요,5,22.03.14.,선택: 힘없는 모발용 샴푸 400ml
향은 제스타일은 아니지만 거품이 잘 나서 좋아요,5,23.04.22.,상품 선택: 묶음할인상품 / 갯수 선택: 2개[10%할인]
좋아요. 자주쓰는 브랜드 믿고구매해요.,5,22.07.10.,
좋아요.거품도 잘나고 세정도 좋음,5,22.03.26.,
싸게잘샀어요 가격대비 만족해요,5,22.05.29.,
하나 구입해서 써보고 좋아서 3개 구입했어요  너무 만족합니다 적극추천,5,22.02.11.,
생각보다 작지만 잘 쓸께요,5,22.11.22.,닥터그루트 샴푸: 400ml (200mlx2개입)
향도 좋고 거품도 많아요,5,22.10.13.,수량: 1개
쓰던거라 좋아요 효과짱,5,22.04.13.,
머리가 힘있어지는 느낌이 좋내요 냄새는 한방냄새 약간 남자향수냄새 암튼 좋습니다,5,20.09.24.,
굿굿굿 좋아용~ 저렴하게 잘샀어요... 재구매 할께용,5,22.11.11.,닥터그루트: 힘없는모발용 샴푸 400ml x 1개
잘받았습니다 너무좋아요 저렴히 잘 구입한것같아요 감사합니다,5,21.10.19.,선택: 400mlX1개
빠른 배송 감사합니다.항상 쓰던건데 저렴하게 잘삿어요,5,22.03.30.,
배송도 무지 빠르고 원하는 패키지 받아서 넘 좋습니다. 감사합니다. 또 구매할게요.~~~,5,21.10.29.,선택: 400mlX1개
좋아요 감사합니다 잘쓰겠습니다,5,22.11.08.,닥터그루트: 손상모발용 샴푸 400ml x 1개
아직 사용한지 일주일밖에 안되었지만머리 기름기도 많이 없어지고 모발이 두꺼워지는거 같습니다!잘쓰고 다쓰면 추가주문 할게요!!,5,21.12.13.,선택: 힘없는 모발용 샴푸 200mlX2개(세트용)
좋아요 좋아요 만족합니다,5,20.10.10.,
이제 2번 사용했습니다다들 좋다고 하니 좋겠죠??머리카락이 풍선해 졌으면...,5,22.12.09.,선택: 탈모증상완화 힘없는모발용샴푸
박스훼손이 심하네요다행히 제품은 이상이 없어서 다행인데 포장에 신경을 써주시면 좋겠어요,5,22.03.24.,닥터그루트: 힘없는모발용 샴푸 400ml x 1개
컵도 잘왔어요!항상남편이 사용하는 것이라서 미리미리 저렴할때 쟁겨둡니다!많이파세요,5,23.01.04.,
가격이 좋아서 쟁여놓으려고 주문했어요,5,23.03.08.,
넵 더 사용해봐야 알수있을듯하네요,5,22.05.20.,
배송이 빠르고 잘 포장되서 왔어요,5,22.08.12.,수량: 1개
기능성이 매우 좋다고 생각됩니다.,5,22.10.07.,
그저 계속 써보는 샴푸입니다.이곳이 가장 싼 것 같습니다.유통기한 24년 12월까지로 넉넉합니다.,5,22.11.02.,
잘 도착 했습니다...,5,21.08.31.,닥터그루트 더마솔루션: 탈모증상 지성두피용 샴푸 400ml
탈모증상이 점차 호전되는듯 합니다 샤워후 탈모가 졸어든 느낌을 하수를 청소하면서 느낌니다,5,22.06.20.,
써왔던거 계속 쓰고 있어요. 머리결이 좋아졌어요.,5,21.12.19.,닥터그루트: 집중케어 컨디셔너 400ml x 1개
잘 받았습니다  사은품 머그컵 아주 좋숩니다,5,23.03.07.,
배송도 빠르고 좋아요~좋아요~좋아요~~~~~~,5,23.03.06.,
나이들어가면서 머리가 힘이없어지고 숱이없어지는거같아 조금이라도 도움되고자 계속 쓰고있네요~~향도좋고 거품도 풍성해서 좋아요,5,22.01.13.,
배송도 빠르고 제품도 좋아요. 거품도 잘나고 냄새도 한방냄새 섞인 레몬향?? 생각보다 괜찮아요. 머릿결이 좋아지는건 모르겠어요 세정력은 좋아요,5,22.09.24.,닥터그루트: 집중케어 컨디셔너 400ml x 1개
적극추천합니다 적극추천합니다 적극추천합니다,5,23.03.06.,
조아요조아요조아요조아,5,21.04.17.,
"몇년 전부터 탈모가 시작되어 여러가지 샴푸를 온오프라인에서 비교하여 이 제품으로 결정, 꾸준히 사용하고 있습니다.탈모방지에 많은 도움이 되었고, 샴푸 후 머리가 가라앉지 않고 풍성하게 보이는 것도 무척 좋 습니다.",5,23.04.20.,선택: 01 힘없는모발용 샴푸400ml x 1개
긴머리인데 머리카락이 너무 빠져서 쓰게되었는데 빠지는양이 좀 줄어서 만족합니다.거품도 적당하고 세정력도 좋으나 머릿결이 뻣뻣해서 트리트먼트 제품을 같이 사용해야할거같습니다,5,22.01.26.,
샴푸에 진심인 1인입니다ㅎㅎ좋은 샴푸(탈모 기능위주) 찾아다니는 유목민인데 이 제품은 재구매예요. 거품 풍성하고 머리카락 빠지는게 확실히 줄었어요. 당분간 정착입니다. 더욱 번창하세요^^,5,21.12.05.,
탈모샴푸 써서 그런지 진짜로 머리카락이 난거 같아요.그래서 또 구입했어요.이번엔 아들기숙사로 보내서 사진은 없지만 아들도 만족해서 이것만 쓰고 있어요.그러나 너무 비쌉니다.,5,22.10.20.,
샴푸향이 많이 강하나 거품이 풍성하고 가려움이 없어지고 탈모도 조금씩 줄고 있어서 아주 만족스러워요계속 이 제품을 사용할거예요,5,22.12.10.,
아직은 사용한지 얼마 되지 않아서 탈모 케어가 잘 되는지 모르겠지만 확실히 거품도 풍부하고 시원해서 좋은 것 같아요 양도 적당해요 잘 사용하겠습니다,5,21.12.07.,
"세번째로 구입해서 쓰고있습니다.머리에 큰 자극을 주지도않고, 머릿결도 나쁘지않습니다. 거품도 많이 나오구요. 큰 문제없으면 당분간은 이 샴푸만 사용할것같네요.",5,22.05.30.,
항상 사용하는 샴푸라 샀는데 머리카락이 덜 빠지는 거에 도움을 주긴 합니다. 그래도 스트레스 안받는 게 최고의 방지방법이에요!,5,22.10.01.,
쓰던 제품인데 다 떨어져서 여기서 저렴하게 구매했어요! 향도 좋고 거품도 잘 나요 머리 볼륨이 조금은 사는 듯핟 느낌이 듭니다!,5,23.08.24.,
개인적으로 샴퓨유목민으로써 정착할수 있는 아이템중 하나!! 모발에 볼륨 들어가는거 눈에 보일정도로 효과있구요 머리카락도 좀 덜빠지고 좋아요,5,22.04.20.,선택: 힘없는 모발용 샴푸 400ml
예전에 선물로 들어와서 써보고 생각나서 주문했어요. 머릿결은 샴푸만 사용했을때 뻣뻣해요. 모발이 가늘고 숱도 없거든요. 꾸준히 사용해볼게요.,5,23.04.24.,선택: 01 힘없는모발용 샴푸400ml x 1개
마트에서 사서 쓰고있던 제품인데 행사할때 가격도 좋고 컵도 받고 딱 좋네요 샴푸향은 한약같은 향이 좀나고 탈모는 몇통째쓰고 있지만 더 꾸준히 써봐야알것같네요 컵도이뻐요,5,23.03.18.,
어머니가 사용하시는 샴푸인데 뿌리부분을 살려줘서 정말 좋다고 하십니다. 저렴한 가격에 잘 샀어요. 다음에 또 주문할게요.,5,23.03.18.,
제형이 쫀쫀하고 거품 잘 나요 탈모 방지용으로 꾸준히 쓰고 있는데 일단 머리가 잘 안 가라앉아서 그게 최대 장점이에요,5,22.01.08.,
우연히 선물로 받아 사용해보니 좋아서 꾸준히 쓰고 있는 제품입니다싸게 구입해서 만족스럽구요다음에 재구매 할께요~,5,22.04.27.,
원래 쓰던제품인데 다 떨어져서 재구매요! 탈모샴푸 이것저것 써봤는데 그나마 화해기준 성분이 나쁘지않아서 씁니당!,5,20.11.26.,
머리카락이 얇고 처지는스타일이라 이샴푸사용하는데 확실히 볼륨이 살아나서 좋은거같아요~배송도 빠르고 가격도 좋아요!추천해요!,5,23.06.15.,수량선택: 3개(400원할인)
나이들수록 더 얇아지고 힘 없는 머리카락에도움 되었음 좋겠네요스벅 컵도 원하던 검정으로 왔어요 감사합니다,5,23.03.08.,
스벅 컵 살때마다 잘 깨먹었는데사은품으로온컵  튼튼함모두5걔구입 샴푸는 시골 가저가야 할것 같아요컵 강추,5,23.03.08.,
지난번에 한세트 구매하고 컵 하나 더 받으려고 또 주문했는데 컵은 여전히 검정이네요ㅋ모든 컵이 전부 다 검정만 있는듯요ㅋ어쨌든 한 쌍으로 컵 쓸 수 있으니 좋네요~~~~,5,23.01.13.,
생각보다 뻑뻑하지도 않고볼륨감이 살아나고오후되어도 떡?지지 않아서 너무 좋네요몇개 쟁여서 써보려구요!,5,22.11.06.,
신랑이 ts쓰는데 이걸로 바꿔줘봤는데 좋대여 향도 한방향 심하지않고 박하향이 살짝 섞여서 괜찮아요마일드한데 거품도 잘난데여,5,21.10.24.,
탈모와 모근강화를 위해 구입했는데 샴푸할때 화~~한냄새가 기분이 좋네요~~ 쓴지 몇일안돼 탈모개선은 좀더 사용해봐야 할것 같아요,5,21.10.02.,
슬슬 더워지는데 기름기 많은 두피에 쓰기 딱 좋은거같아요 세정력 좋고 거품 잘 나네요 감고나면 시원해요^^,5,22.04.20.,
아직 좀 더 사용햬봐야겠지만 머리카락 빠짐이 덜하고 볼률감은 up되는 듯 합니다향도 은은하니 괜찮네요.^^*,5,21.05.29.,
미녹시딜 성분이 들어있네요. 탈모에 도움될것같아 구매했는데 배송도빠르고 사용감도 좋았어요. 사용기한25년까지. 충분하구요,5,22.07.23.,수량: 2개
거품도 풍성하고 세정력도 마음에 들어요샴푸가 떨어져서 다른 샴푸를 잠시 썼는데 기름지고 세정력도 별로고ㅠ바꾸자마자 머리도 뽀송하고 모발에 힘도 생기네요! 잘 사용하겠습니다:),5,22.07.29.,수량: 2개
오늘 배송받고 바로 써봤습니다.묽은데 거품이 잘나고 세정력이 좋습니다 만족스러워요 단 머릿결은 더 써봐야알것같아서 한달뒤후기 올릴게요,5,22.07.15.,옵션: 지성두피용 샴푸 400ml 2개+3종 증정
이 샴푸 쓰고는 다른걸 못쓰겠어요흰머리염색때문에 두피가 민감해서 비싼 샴푸만 이것저것 써보다가 결국 이 샴푸로 정착했어요두피가 아주 산뜻해져서 너무 좋아요머그컵도 잘 쓰겠습니다,5,23.03.09.,
평소 사용중인 제품을 인터넷으로 더 저렴하게 구입해서 만족합니다. 탈모방지샴푸로 좋은것 같아요.,5,22.01.20.,
"가족이 모두 사용하고 있습니다. 탈모 예방도 좋지만, 머리가 기름지지 않아 좋아요. 기능성 샴푸맘ㄴ 계속 사용하면 머리결이 다소 뻣뻣하거나 푸석해지는데.. 이건 조금 덜해서 좋아요.",5,22.10.31.,
머리가 너무 빠져서 유명하다길래 사봤어요 받자마자 썼는데 거품도 잘나고 세정력도 좋아요 제발 효과봤음 좋겠어요ㅠㅠ,5,22.11.16.,
사용할때마다 만족스러워서 구매하게 되는데 저렴한 가격에 좋은샴푸를 쓸수있어서 좋았습니다.,5,22.12.20.,
이제 막 사용해봤어요향은좋아요.. 세정후 약간 뻣뻣한 느낌인데좀더 써봐야알듯..  번창하세요,5,21.04.24.,
매일 감지않으면 두피가 간지러운데 이샴푸는 괜찮네요 탈모걱정으로 구입했는데 두피세정력도 좋은것 같아 만족해요,5,22.04.13.,선택: 힘없는 모발용 샴푸 200mlX2개(세트용)
꼼꼼히 포장되어 왔어요! 리뉴얼 되기 전부터 썼는데 거품도 잘 나고 세정력도 괜찮고 좋아요!,5,22.12.05.,
써보니 좋은 것 같아요. 가격도 이 곳이 가장 착한 것 같네요. 효과 있으면 재구매하겠습니다!,5,23.01.26.,힘없는 모발용 샴푸 400ml: 400ml(200ml x 2개입)
일단  오픈마켓보다 많이 저렴하게  구매 감사드립니다 이것저것  써봐도 요제품이 좋은듯,5,23.06.18.,수량선택: 1개
향도  나쁘지  않고  거품도  풍성해서  좋긴한데탈모에  도움되는지는 잘  모르겠어요,5,22.09.10.,닥터그루트: 집중케어 컨디셔너 400ml x 1개
샴푸를 소량 사용해도 거품이 잘나고머릿결이 부드럽고 머리카락이 덜 빠져요 좋아요,5,22.10.27.,
리뉴얼된제품 찾던중이었는데 맞네요 빠른배송 정말 꼼꼼한 포장에 감동입니다 잘받았어요 재구매 의사있어요,5,22.08.05.,수량: 1개
"사용후기가 좋아서 이번에 처음 구매해서 사용 중입니다. 탈모 방지효과는 좀 더 써봐야 알겠지만, 우선 거품, 세정력 모두 만족합니다.",5,22.05.19.,선택: 힘없는 모발용 샴푸 400ml
원래 쓰던 건에 다른 거 쓰다 다시 돌아왔어요. 향도 좋고 두피도 깔끔한 느낌입니다,5,22.11.03.,
닥터그루샴푸  항상  사용하는  샴푸에요.  세일해서  구매함....싸게사서  좋구  예쁜컵도  받아서  너무  좋으네요,5,23.03.07.,
늘 쓰던 거라 처음 인터넷으로 시켜봤는데 가격도 저렴하고 배송도 빨라서 좋네요!,5,21.11.13.,
긴가민가하면서 좀 비싸도 사보자 햇는데 약한 모발에 짱이예요!!탈모도 훨씬.줄었고 모발도 힘이 있어졌어요!!,5,20.10.18.,
모발에 힘이 없고 자꾸 머리가 마니 빠져서 구매했어요 오늘 처음 사용해봤는데 냄새도 갠찮아요 꾸준히 사용해서 효과 보고 싶네요,5,21.11.19.,
탈모 예방효과가 있을거 같아서 항상 사용하고있습니다   거품도 풍부해 좋아요,5,23.03.08.,
주말에 주문했는데 월요일 아침에 받았네요👍넘 저렴하게 득템했어요. 쵝오~,5,22.11.07.,옵션: 지성두피용 400ml+앱솔루트샴푸200ml
머리 감으면 뻑뻑하긴 하지만 탈모샴푸치고 거품도 많이나고 세정력이 좋아요!,5,22.03.09.,
원래쓰던거라 주문해요.. 가을철 머리카락 유독빠졌는데 덜빠져서 좋아요,5,22.09.20.,
매일 사용하던거 저렴하게 사고싶어서 찾다가 여기에서 구매했어요 다 쓰고나서 재구매 의사있답니다,5,21.03.26.,
샴푸 만족합니다. 저렴하게 잘 구매했어요 상품은 다행히 파손 없었지만 박스가 다 찢어져서 왔어요 ㅠㅠ,5,23.03.28.,선택: 02 힘없는모발용 샴푸400ml x 1개
"거품도 풍성하고 좋아요~볼륨감은 아직모르겠어요,더 사용해봐야 할듯",5,23.04.21.,선택: 02 힘없는모발용 샴푸400ml x 1개
항상 쓰는 제품이에요. 좋아요~~ 포장도 아주 꼼꼼하게 잘 돼서 왔어요~,5,21.07.23.,
남편 탈모로쓰라고 사줬는데 거품이 무척이나풍부하고 좋다네요.저도쓰고있는데 괜찮은거같아요,5,23.04.26.,
잘 쓰고 있습니다 여름이라 머리가 잘 떡져서 구매했어요 효과 좋네용,5,22.07.30.,
항상 사용하던거라서 구매했습니다. 세정력도 좋고 가격도 적당해요^^,5,22.04.25.,
적은 양으로도 거품 잘 나고 세정력도 좋은거 같아요 잘 쓰겠습니다 ~,5,22.03.22.,선택: 힘없는 모발용 샴푸 400ml
가격이비싸긴하지만 신랑이 이샴푸만고집하네요 매번잘쓰고있어요,5,21.10.22.,
샴푸만 했는데도 헹굼시 머리결이 부드러웠어요. 탈모는 좀더 써봐야 알겠지만 사용감은 좋았어요,5,22.08.06.,
거품 잘 나네요 잘 쓸게요 머리빠짐방지효과는 아직 잘 모르겠어요,5,21.06.03.,
항상 사용하는 샴푸인데 가격도 저렴하구 배송도 빨라서 좋습니다.,5,22.11.10.,
닥터그루트샴푸가 젤괜찮아서 샀어요 저렴한가격에 잘산거같아용,5,22.02.07.,선택: 힘없는 모발용 샴푸 200mlX2개(세트용)
시원하게 잘 씻겨서 좋고 향도 마음에 들어요 제 두피랑 잘맞아요,5,21.11.30.,
모발이 튼튼해지는것을 느끼는 요즘이네요..좋아요..강추합니다..,5,22.01.04.,
써보고 산 제품이라 좋아요여기 젤 저렴해서 좋네요감사합니다 ^^,5,22.10.27.,
지인추천받고 써봤는데 듣던데로 믿고살만하네요ㅎ잘쓰겠습니다,5,22.05.13.,
계속 애용하는 샴푸예요향도좋고 거품도 풍부하고 잘쓰겠습니다,5,22.03.04.,선택: 힘없는 모발용 샴푸 400ml
원래 쓰던거에요 거품도 잘나고 세정력도 좋아서 재구매했어요~,5,23.02.22.,옵션: 지성두피샴푸400ml+제이몬75ml2개
가격은 비싸지만 건성에 머리숱없어서 꾸준히 이용하고 있어요,5,22.06.08.,
처음 써보는데 느낌좋아요확실히 머리 덜 삐지고  부드럽네요~,5,21.10.12.,선택: 200mlX2개(세트용)
"어제 받자마자 바로 썼는데, 향이나 세정력이 만족 스러웠어요! 거품도 많이 나서 감기 좋았어요!!!",5,22.02.25.,선택: 힘없는 모발용 샴푸 200mlX2개(세트용)
사용한지 얼마되지않아 잘모르겠지만 거품잘나고 시원하네요,5,21.10.24.,
머리카락 빠지는 갯수가 적은것 같아요. 리뷰믿고 구매했어요,5,22.11.16.,
유통기한도 넉넉하고 배송 빠르고 좋아요 또 구매하러올게요,5,23.01.27.,힘없는 모발용 샴푸 400ml: 400ml
원래 쓰던 제품이라 재구매했네요세정력 좋아요~많이 파세요,5,22.06.16.,
항상 사용하던 제품입니다사는 김에 하나 더 구매할걸 그랬나봐요 ㅎㅎ재구매 의사도 있어요~,5,23.07.15.,닥터그루트: 힘없는 모발용 샴푸 400ml x 1개
향도 좋고 머리카락에 좋은것 같네요.또 구입할것 같습니다.,5,21.11.10.,
배송도 빠른편이고 만족합니다~항상 쓰는 제품인데 좋아요:),5,21.04.02.,
늘 쓰던거라 주문했어요 하나가 뚜껑이 살짝 열려서와서 조금 샜어요 앞으로 유의부탁드려요,5,23.08.17.,닥터그루트 힘없는 모발용 샴푸 400ml: 샴푸 190ml x 3
탈모방지에 좋다고해서 사봤어요 아직 안써봐서 효과가 있는지는 모르겠지만 싸게 잘 샀어요,5,22.02.17.,선택: 탈모증상완화 힘없는모발용샴푸
이틀만에 빠르게 왔습니다. 매장구매보다 저렴하니 좋네요.,5,23.02.21.,선택: 02 힘없는모발용 샴푸400ml x 1개
어머니가 모발이 힘이 없어서 산건데 만족하시는 것 같아요,5,23.05.15.,선택: 02 힘없는모발용 샴푸400ml x 1개
향도 좋고 샴푸후 드라이할때 좀 풍성하게 되서 좋습니다.,5,23.02.22.,
항상 쓰고 있는 제품이예요 ~ 좋아요 머리에 힘도 생기고,5,21.11.15.,
오프라인보다 저렴한 가격에 구입할 수 있어서 좋아요 :),5,22.09.07.,수량: 2개
배송은 보통입니다비가 와서 그런지 박스는 찢어지기 직전이었어요그래도 새거나 다른문제는 없었어요사은품도 넣어주시고 여지껏 포장 이렇게꼼꼼하게 온적은 처음이에요~!,5,22.07.08.,
써보고 좋아서 다시 더 구매하게 되었습니다. 잘 쓸게요,5,22.07.04.,
항상 쓰는 제품인데  할인으로 저렴하게 구매 했습니다.,5,22.10.20.,
조금만써도 거품이 풍부하고 확실히 볼륨이 살아납니다,5,21.04.18.,
유통기한 넉넉하고 배송빠르고 넘 좋아요 단골될게요^^,5,22.09.15.,선택: 힘없는 모발용 샴푸 400ml
향도 좋고 머릿결이 부드러워지는 느낌이에요. 좋아요!,5,22.08.24.,선택: 힘없는 모발용 샴푸 400ml
늘 쓰던제품 저렴히 구매했어요 배송은 조금 느리네욤,5,22.02.09.,선택: 탈모증상완화 힘없는모발용샴푸
늘 쓰던거라 이번에 두개 주문해보았어요 만족합니다,5,21.05.18.,
닥터그루트 탈모방지 효과가 좋은것같아 구매했어요~,5,22.10.06.,
포장 엄청 꼼꼼하게 왔네요~가격도 용량 대비 아주 저렴하게 샀어요다쓰면 또 구입할게요,5,22.11.23.,닥터그루트 샴푸: 600ml (200mlx3개입)
저렴한가격에^^ 컵도 받고 너무 좋네요 검정색 스타벅스 머그로 받았어요^^마음에들어요!다음에도 행사때 재구매해야겠어요,5,23.03.20.,
아직 쓰던게 있어서 사용은 안했지만 항상 쓰던거라 추천합니다. 가격이 싼데 괜찮기를..,5,22.04.14.,
빠른 배송 감사 드립니다 향기도 무척이나  좋아요,5,20.12.04.,
저렴하게 구매하고 사은품도 챙겨주시고 좋네용~^^,5,23.04.11.,
좋아요!! 추천 받아서 산 제품인데 만족스럽습니당,5,22.02.26.,
할인 행사해서 구매했어요. 저렴하게 사서 좋네요.,5,21.01.24.,
꾸준히 사용하고 있어요.거품도 많고 깨끗한 느낌,5,22.03.25.,
터짐없이 잘 왔습니다.사은품도 좋네요!!잘쓸께요,5,23.03.06.,
원래 쓰던 제품이예요! 저렴하게 구매했습니다 :-),5,22.05.24.,
거품이 잘 나네요. 세정력도 좋고 향도 좋습니다.,5,22.01.10.,
배송빠르고 좋은 상품 저렴하게 구입해서 좋아요,5,22.03.23.,닥터그루트: 지성두피용 샴푸 400ml x 1개
아직 효과는 모르겠는데 거품이 풍성해서 좋아요,5,22.08.02.,
사용하던건데 인터넷으로 저럼하게 샀어요! 또 구매할께요이제품은 사용하고 머리가 축 안쳐져서 좋아요,5,21.02.18.,
배송은 쫌 느렸지만 상품은 아주 싸게 잘 샀어요,5,22.02.26.,
두번째 구매예요~~ 모발 힘있어 보이구 좋은듯요,5,21.10.31.,
항상 사용하는 제품입니다.싸게 잘 구매했어요~,5,21.11.15.,
늘 쓰던 제품입니다세정력 좋고 향도 괜찮아요,5,22.10.05.,옵션: 힘없는 샴푸 400ml+2종 증정
전체적으로 다 만족합니다! 향기도 괜찮아요~~,5,22.12.29.,
처음 써보는데 좋네요 다음에 또 구매 할게요,5,21.12.12.,선택: 탈모증상완화 힘없는모발용샴푸
항상 쓰던제품입니다 저렴하게 잘주문했어요,5,22.05.14.,
대용량을 사용했는데이게 가격이 더 좋네요,5,22.03.30.,
이모가 꾸준히 2년정도 사용해보시고 머리가 많이 가늘고 힘없어보인다고 추천해주셔서 사용중인데 아직까지 별다른거없이 사용중입니다. 저도 꾸준히 사용해보려구요.,5,22.04.26.,
배송도 빠르고 가격도 괜찮고 만족합니다!!,5,22.02.22.,선택: 힘없는 모발용 샴푸 200mlX2개(세트용)
원래 쓰던거라 저렴하게 여기서 잘삿서요,5,22.02.25.,선택: 힘없는 모발용 샴푸 200mlX2개(세트용)
항상 쓰던거라 또 주문해써요아주 좋아요,5,21.11.16.,
아직 안써봤는데 좋은거 같네요 잘쓸게요,5,22.11.08.,닥터그루트 샴푸: No.1) 400ml (200mlx2개입)
빠른배송과꼼꼼한포장거품도많고좋아요,5,22.10.08.,
늘 쓰던 제품 저렴하게 잘 구매했습니다.,5,21.12.31.,
머리에 힘이 없어서 구매했어요잘쓸께요,5,22.10.15.,
사용하니 머리결이 힘이 있네요. 좋아요.,5,22.10.03.,
항상 사용하는 제품입니다.좋은거같아요,5,23.03.15.,
가격저렴하게 잘 구매했습니다.만족해요,5,21.10.29.,
거품 너무 잘나서 좋고 머리숱도 많아진거같아요 저는 다 쓰면 또 구매할거같네요,5,22.04.06.,선택: 힘없는 모발용 샴푸 400ml
좋다는 소문 듣고 주문했어요~잘 쓸께요,5,22.01.10.,
항상잘쓰고있어요 다음에 또주문할게요,5,22.06.22.,
매번쓰던거라 재구매했어요 만족합니다,5,21.10.02.,
저렴하게 잘샀어요 계속사용하던거에요,5,22.08.23.,
"믿고쓰는 닥터그루트샴푸에용~^^힘없는모발용,지성용으로 구매해서 사용중인데 자극적이지 않고 두피에 사용하기 좋아요!!빠른배송 감사합니다🤗",5,22.10.20.,
계속 쓰건건데 거품이 잘나서 너무좋음,5,21.05.04.,
잘쓰겠습니다. 저렴하게 구했어요 ㅎㅎ,5,21.04.13.,
사용한지 3주정도 되었어요. 거품 잘 나고 세정력도 괜찮은것 같아요. 샴푸 효능은 좀 더 써봐야 알 것 같아요,5,22.01.10.,
싸게 잘샀습니다. 또 주문 해야 겠네요,5,21.07.31.,
거품도 풍부하고 머릿결도 좋아졌어요,5,22.10.23.,
좋아요 늘 구매하는거라서라 만족해요,5,22.12.17.,힘없는 모발용 샴푸 400ml: 400ml
